{
  "decision_id": "DEC-PH0-QUOTE-001",
  "agent_id": "INTAKE_DFM_QUOTE_AGENT",
  "agent_version": "V1",
  "decision_type": "quote",
  "target_refs": ["SO-PH0-DEMO-001", "PART-BRACKET-001"],
  "recommendation": {
    "quote_level": "budget",
    "cost_drivers": ["material", "machine_time", "setup", "inspection", "risk_buffer"],
    "risk_summary": "Budget quote depends on confirming drawing revision, stock form, and first-article inspection scope."
  },
  "evidence_refs": ["drawing://DWG-BRACKET-001/A", "cad://CAD-BRACKET-001/A", "template://QUOTE-BRACKET-V1"],
  "assumptions": [
    "Material lot matches frozen material specification.",
    "One validation-machine setup is sufficient for the first OEP.",
    "Formal commercial commitment requires human review."
  ],
  "risk_level": "medium",
  "required_approval": true,
  "affected_objects": ["Quotation", "CustomerOrder", "Part"],
  "proposed_events": ["Quote.Proposed", "Decision.Recorded"],
  "adoption_status": "proposed",
  "reviewer": null,
  "review_notes": null
}
